{
  "schema": "squadpad.playback.v1",
  "id": "rondo-4v1.level-1.segment-0.pass-receive",
  "units": {
    "distance": "centimetres",
    "time": "seconds",
    "angle": "degrees"
  },
  "axes": "unreal-z-up-x-forward",
  "root_ownership": "actor_tracks_only",
  "duration_seconds": 3.7925,
  "motions": [
    {
      "id": "canonical.idle",
      "duration_seconds": 4.1
    },
    {
      "id": "canonical.pass",
      "duration_seconds": 3.3925
    },
    {
      "id": "canonical.receive",
      "duration_seconds": 1.3
    }
  ],
  "actors": [
    {
      "id": "A",
      "appearance_slot": "actor.A.appearance",
      "transform_keys": [
        {
          "time_seconds": 0.0,
          "position_cm": [
            298.96081519925474,
            289.77859580032316,
            0.0
          ],
          "yaw_degrees": -135.0
        },
        {
          "time_seconds": 0.016666666666666666,
          "position_cm": [
            298.96081519925474,
            289.77859580032316,
            0.0
          ],
          "yaw_degrees": -135.0
        },
        {
          "time_seconds": 0.03319999948143959,
          "position_cm": [
            298.96081519925474,
            289.77859580032316,
            0.0
          ],
          "yaw_degrees": -135.0
        },
        {
          "time_seconds": 0.03333333333333333,
          "position_cm": [
            298.96595575392206,
            289.7777935805788,
            0.0
          ],
          "yaw_degrees": -135.0
        },
        {
          "time_seconds": 0.05,
          "position_cm": [
            299.6085225882645,
            289.67751650253285,
            0.0
          ],
          "yaw_degrees": -135.0
        },
        {
          "time_seconds": 0.06666666666666667,
          "position_cm": [
            300.2494934857821,
            289.57762837294285,
            0.0
          ],
          "yaw_degrees": -135.0
        },
        {
          "time_seconds": 0.08333333333333333,
          "position_cm": [
            300.7923146565,
            289.50166047884943,
            0.0
          ],
          "yaw_degrees": -135.0
        },
        {
          "time_seconds": 0.1,
          "position_cm": [
            301.3281383760551,
            289.42767290557344,
            0.0
          ],
          "yaw_degrees": -135.0
        },
        {
          "time_seconds": 0.11666666666666667,
          "position_cm": [
            301.5793975002149,
            289.43421882642826,
            0.0
          ],
          "yaw_degrees": -135.0
        },
        {
          "time_seconds": 0.13333333333333333,
          "position_cm": [
            301.82511111868655,
            289.4416322220909,
            0.0
          ],
          "yaw_degrees": -135.0
        },
        {
          "time_seconds": 0.15,
          "position_cm": [
            301.90307386407824,
            289.47528662525974,
            0.0
          ],
          "yaw_degrees": -135.0
        },
        {
          "time_seconds": 0.16666666666666666,
          "position_cm": [
            301.97775304396544,
            289.5109222949735,
            0.0
          ],
          "yaw_degrees": -135.0
        },
        {
          "time_seconds": 0.18333333333333332,
          "position_cm": [
            301.9591411216178,
            289.60284876794515,
            0.0
          ],
          "yaw_degrees": -135.0
        },
        {
          "time_seconds": 0.2,
          "position_cm": [
            301.9397609330616,
            289.69467274673235,
            0.0
          ],
          "yaw_degrees": -135.0
        },
        {
          "time_seconds": 0.21666666666666667,
          "position_cm": [
            301.9028568005047,
            289.7841588609519,
            0.0
          ],
          "yaw_degrees": -135.0
        },
        {
          "time_seconds": 0.23333333333333334,
          "position_cm": [
            301.86351821410744,
            289.87408014070877,
            0.0
          ],
          "yaw_degrees": -135.0
        },
        {
          "time_seconds": 0.25,
          "position_cm": [
            301.77792490026997,
            289.97226958435004,
            0.0
          ],
          "yaw_degrees": -135.0
        },
        {
          "time_seconds": 0.26666666666666666,
          "position_cm": [
            301.6882066081165,
            290.0691127434437,
            0.0
          ],
          "yaw_degrees": -135.0
        },
        {
          "time_seconds": 0.2833333333333333,
          "position_cm": [
            301.53149206282944,
            290.14409008569254,
            0.0
          ],
          "yaw_degrees": -135.0
        },
        {
          "time_seconds": 0.3,
          "position_cm": [
            301.36892057486386,
            290.215947480101,
            0.0
          ],
          "yaw_degrees": -135.0
        },
        {
          "time_seconds": 0.31666666666666665,
          "position_cm": [
            301.1234638121804,
            290.24365253291353,
            0.0
          ],
          "yaw_degrees": -135.0
        },
        {
          "time_seconds": 0.3333333333333333,
          "position_cm": [
            300.869578508898,
            290.2694488032197,
            0.0
          ],
          "yaw_degrees": -135.0
        },
        {
          "time_seconds": 0.35,
          "position_cm": [
            300.5102221834291,
            290.271359415065,
            0.0
          ],
          "yaw_degrees": -135.0
        },
        {
          "time_seconds": 0.36666666666666664,
          "position_cm": [
            300.143687709014,
            290.2725563362992,
            0.0
          ],
          "yaw_degrees": -135.0
        },
        {
          "time_seconds": 0.38333333333333336,
          "position_cm": [
            299.696793000087,
            290.26576340593,
            0.0
          ],
          "yaw_degrees": -135.0
        },
        {
          "time_seconds": 0.4,
          "position_cm": [
            299.24424887292696,
            290.25765201780234,
            0.0
          ],
          "yaw_degrees": -135.0
        },
        {
          "time_seconds": 0.4166666666666667,
          "position_cm": [
            298.734583039867,
            290.2362096010259,
            0.0
          ],
          "yaw_degrees": -135.0
        },
        {
          "time_seconds": 0.43333333333333335,
          "position_cm": [
            298.22224612562877,
            290.2192125193333,
            0.0
          ],
          "yaw_degrees": -135.0
        },
        {
          "time_seconds": 0.45,
          "position_cm": [
            297.6853245085889,
            290.2431304209747,
            0.0
          ],
          "yaw_degrees": -135.0
        },
        {
          "time_seconds": 0.4666666666666667,
          "position_cm": [
            297.1370068221079,
            290.2830807420137,
            0.0
          ],
          "yaw_degrees": -135.0
        },
        {
          "time_seconds": 0.48333333333333334,
          "position_cm": [
            296.48612426612334,
            290.46732318165004,
            0.0
          ],
          "yaw_degrees": -135.0
        },
        {
          "time_seconds": 0.5,
          "position_cm": [
            295.8294256011917,
            290.65663277823035,
            0.0
          ],
          "yaw_degrees": -135.0
        },
        {
          "time_seconds": 0.5166666666666667,
          "position_cm": [
            295.12469020455876,
            290.88779332031766,
            0.0
          ],
          "yaw_degrees": -135.0
        },
        {
          "time_seconds": 0.5333333333333333,
          "position_cm": [
            294.41640441973465,
            291.08379943943123,
            0.0
          ],
          "yaw_degrees": -135.0
        },
        {
          "time_seconds": 0.55,
          "position_cm": [
            293.6810618342947,
            291.01190070928783,
            0.0
          ],
          "yaw_degrees": -135.0
        },
        {
          "time_seconds": 0.5666666666666667,
          "position_cm": [
            292.9415905259567,
            290.9463418811731,
            0.0
          ],
          "yaw_degrees": -135.0
        },
        {
          "time_seconds": 0.5833333333333334,
          "position_cm": [
            292.17295193561307,
            290.9255711667008,
            0.0
          ],
          "yaw_degrees": -135.0
        },
        {
          "time_seconds": 0.6,
          "position_cm": [
            291.4024355224838,
            290.9188403031398,
            0.0
          ],
          "yaw_degrees": -135.0
        },
        {
          "time_seconds": 0.6166666666666667,
          "position_cm": [
            290.61957089587696,
            291.0044328886155,
            0.0
          ],
          "yaw_degrees": -135.0
        },
        {
          "time_seconds": 0.6333333333333333,
          "position_cm": [
            289.85027505229027,
            291.0691357794826,
            0.0
          ],
          "yaw_degrees": -135.0
        },
        {
          "time_seconds": 0.65,
          "position_cm": [
            289.16432957156655,
            291.00551738883615,
            0.0
          ],
          "yaw_degrees": -135.0
        },
        {
          "time_seconds": 0.6666666666666666,
          "position_cm": [
            288.50526407915623,
            290.9277227803271,
            0.0
          ],
          "yaw_degrees": -135.0
        },
        {
          "time_seconds": 0.6833333333333333,
          "position_cm": [
            288.0009407239136,
            290.76831882647764,
            0.0
          ],
          "yaw_degrees": -135.0
        },
        {
          "time_seconds": 0.7,
          "position_cm": [
            287.5168037130762,
            290.59315568344635,
            0.0
          ],